{"recommendationId":"22222222-2222-4222-8222-222222222222","pillar":"Knowledge","site":"LU","relatedPredictionId":null,"relatedHeatId":null,"summary":"Use the documented low-rate tap-hole cooling inspection procedure before shift handover.","rationale":"The answer is grounded in the approved operator procedure and passed content safety review.","expectedImpact":{"answerCoveragePercent":70.0,"operatorTimeSavedMinutes":18.0},"citations":[{"sourceId":"knowledge:operator-interview:LU-2026-06","title":"Senior Operator Interview - Furnace Cooling Practices","locator":"00:14:32"}],"confidence":0.82,"contentSafetyPassed":true,"conflictsWith":null,"status":"Approved"}
